{"$schema":"https://json-schema.org/draft/2020-12/schema","$id":"https://vexil-lang.org/release/schemas/release-evidence-set-1.0.schema.json","type":"object","additionalProperties":false,"required":["$schema","recordKind","schemaVersion","evidenceSetId","steward","reviewedAt","entries"],"properties":{"$schema":{"const":"https://vexil-lang.org/release/schemas/release-evidence-set-1.0.schema.json"},"recordKind":{"const":"release-evidence-set"},"schemaVersion":{"const":"1.0"},"evidenceSetId":{"$ref":"#/$defs/id"},"steward":{"$ref":"#/$defs/principal"},"reviewedAt":{"$ref":"#/$defs/time"},"entries":{"type":"array","items":{"type":"object","additionalProperties":false,"required":["kind","id","path","contentDigest"],"properties":{"kind":{"type":"string","minLength":1},"id":{"$ref":"#/$defs/id"},"path":{"type":"string","minLength":1},"contentDigest":{"$ref":"#/$defs/digest"}}}}},"$defs":{"id":{"type":"string","pattern":"^[a-z0-9][a-z0-9._-]*$"},"digest":{"type":"string","pattern":"^[0-9a-f]{64}$"},"time":{"type":"string","pattern":"^[0-9]{4}-[0-9]{2}-[0-9]{2}T[0-9]{2}:[0-9]{2}:[0-9]{2}Z$"},"principal":{"type":"object","additionalProperties":false,"required":["actor","role","assignment"],"properties":{"actor":{"type":"string","minLength":1},"role":{"const":"release-steward"},"assignment":{"type":"string","minLength":1}}}}}
