{"$schema":"https://vexil-lang.org/release/schemas/release-evidence-set-1.0.schema.json","entries":[{"contentDigest":"a4dbff359730313e057dffdf162cf5d551fc5eea8cc8ff03e73b8e7b9d465733","id":"catalog","kind":"compatibility-input","path":"release/catalog.json"},{"contentDigest":"8a4c69db6abe8fbfcd3d0940ea705633606605ea461e9a359cd16298cee93606","id":"compatibility-report","kind":"compatibility-input","path":"release/evidence/compatibility-runtime-go-0-1-1-2026-07-26.md"},{"contentDigest":"0ed871144171d2fa69472ed4862bfc29fe8e0935f7196860b3bd55d2b53bddf2","id":"go-module","kind":"compatibility-input","path":"packages/runtime-go/go.mod"},{"contentDigest":"335ddb00f752f9019dd6a281b5c50b366ed4a03fe3ef6bf2a4976ba03310bfb2","id":"go-readme","kind":"compatibility-input","path":"packages/runtime-go/README.md"},{"contentDigest":"3dd62d2186f4ea07571ee376efd355566ca2b14a32d3e4c15a357e6c1c7758a1","id":"go-source-compliance","kind":"compatibility-input","path":"packages/runtime-go/compliance_test.go"},{"contentDigest":"f7f28bccf91ce0ac01837eff38f138cee97f886e278b1f05399f0fe48fc9030d","id":"go-source-delta","kind":"compatibility-input","path":"packages/runtime-go/delta_compliance_test.go"},{"contentDigest":"80447316529fc62014fbaa047fb67c51ac30e32830cda370405349d8d66d196c","id":"go-version","kind":"compatibility-input","path":"packages/runtime-go/VERSION"},{"contentDigest":"a0eb4923c0db384958c2933a9ba45949cf9143008c9f82f4ee926f9b6a06a2c6","id":"go-vulnerability-scan","kind":"compatibility-input","path":"release/security/scans/go-runtime-go-2026-07-26.md"},{"contentDigest":"9ea0398664e323fe5c66998ea3e9a379176146960d0fed95c4552f3ac57fc916","id":"release-selection","kind":"compatibility-input","path":"release/decisions/first-recovered-release-set-2026-07-26.json"},{"contentDigest":"d8e12762944c88d9c64ea568b6d5add8e1f3366b55a9c96745781d52e83840db","id":"specification","kind":"compatibility-input","path":"spec/vexil-spec.md"},{"contentDigest":"5130c32b70c473fbb02befd824d641539f1208759a2b1ca387890605b8901412","id":"vector-arrays-maps","kind":"compatibility-input","path":"compliance/vectors/arrays_maps.json"},{"contentDigest":"d598cf5e154460a3015bcf85a3fe15d65d2f2405495993292caf4af794710510","id":"vector-delta","kind":"compatibility-input","path":"compliance/vectors/delta.json"},{"contentDigest":"8081fb1b73adeeaf4a90ff89f5675cfdf13d388729d9e65bb9f51a4e9487dd21","id":"vector-enums","kind":"compatibility-input","path":"compliance/vectors/enums.json"},{"contentDigest":"c5567ff576d8497a0034cbcdd6679bcf963b647a3c7d0d265fac0495022f4b02","id":"vector-evolution","kind":"compatibility-input","path":"compliance/vectors/evolution.json"},{"contentDigest":"79b5960e7b550ffc780e0c071672af4180bb2d32a77f0a15a98601c991f6386e","id":"vector-messages","kind":"compatibility-input","path":"compliance/vectors/messages.json"},{"contentDigest":"6499fd7721a9e280e0e298f8498395d7a36ad7f725030e219615b596129fc882","id":"vector-optionals","kind":"compatibility-input","path":"compliance/vectors/optionals.json"},{"contentDigest":"751b0dc1dfef2911b47ed34b800be4d4ebcf67fd5ce9de2db4dce87847732979","id":"vector-primitives","kind":"compatibility-input","path":"compliance/vectors/primitives.json"},{"contentDigest":"96ba267899a24b52cc778b4831bacdd06442ee00af93c1f90c847c91ae1d083d","id":"vector-sub-byte","kind":"compatibility-input","path":"compliance/vectors/sub_byte.json"},{"contentDigest":"90a9c30267f1ce561947f6f4b177774b71ec1142449bd5793bb57d36c833fcd8","id":"vector-unions","kind":"compatibility-input","path":"compliance/vectors/unions.json"},{"contentDigest":"abdb5aa9645e19b5d0834634fbbcda4eacd33bf68dd10f656f26f5278eb614fc","id":"version-rationale","kind":"compatibility-input","path":"release/rationales/vexil-runtime-go-0-1-1.json"},{"contentDigest":"493c44b1c25ded18d7e9d008be91ebfb5f443fd7753473bc6393d88f11b0daeb","id":"wire-schema","kind":"compatibility-input","path":"schemas/vexil/schema.vexil"}],"evidenceSetId":"runtime-go-0.1.1-compatibility-2026-07-26","recordKind":"release-evidence-set","reviewedAt":"2026-07-26T19:15:00Z","schemaVersion":"1.0","steward":{"actor":"github:furkanmamuk","assignment":"assignment-release-steward-2026-07-14","role":"release-steward"}}
